{
  "schemaVersion": 1,
  "kind": "diagnostic-bundle",
  "bundleID": "77777777-7777-4777-8777-777777777777",
  "createdAt": "2026-07-23T15:00:00Z",
  "appVersion": "0.1.0",
  "osVersion": "26.5.2",
  "models": [
    {
      "capability": "asr",
      "artifactID": "fixture-asr",
      "version": "1.0.0"
    }
  ],
  "events": [
    {
      "correlationID": "88888888-8888-4888-8888-888888888888",
      "recordedAt": "2026-07-23T15:00:00Z",
      "category": "inference",
      "state": "recovered",
      "durationMilliseconds": 125,
      "retryCount": 1,
      "metrics": [
        {
          "name": "realtimeFactor",
          "value": 0.5
        }
      ]
    }
  ],
  "redactedFields": [
    "audioPath",
    "participantName",
    "speakerEmbedding",
    "transcriptText",
    "windowTitle"
  ]
}
